<?xml version="1.0" encoding="UTF-8"?>
<!-- Mit XMLSpy v2008 rel. 2 sp2 (http://www.altova.com) von Domagoj Cosic (IVU) bearbeitet -->
<!--Sample XML file created as an example of an EML 510b document-->
<!--Created by Jan Verburg (secretariaat Kiesraad)-->
<!--Creation date and time 2008-10-09 16:52:34-->
<EML Id="510b" SchemaVersion="5" xsi:schemaLocation="urn:oasis:names:tc:evs:schema:eml 510-count-kiesraad-strict.xsd http://www.kiesraad.nl/extensions kiesraad-eml-extensions.xsd http://www.kiesraad.nl/reportgenerator reportgenerator-eml-extensions.xsd" xmlns="urn:oasis:names:tc:evs:schema:eml" xmlns:xsi="http://www.w3.org/2001/XMLSchema-instance" xmlns:xnl="urn:oasis:names:tc:ciq:xsdschema:xNL:2.0" xmlns:ds="http://www.w3.org/2000/09/xmldsig#" xmlns:kr="http://www.kiesraad.nl/extensions" xmlns:rg="http://www.kiesraad.nl/reportgenerator">
    <TransactionId>1</TransactionId>
    <ManagingAuthority>
        <AuthorityIdentifier Id="0951">Gemeente Nuth</AuthorityIdentifier>
        <AuthorityAddress/>
    </ManagingAuthority>
    <kr:CreationDateTime>2009-02-19T21:04:05.123+01:00</kr:CreationDateTime>
    <ds:CanonicalizationMethod Algorithm="http://www.w3.org/TR/2001/REC-xml-c14n-20010315#WithComments"/>
    <Count>
        <EventIdentifier/>
        <Election>
            <ElectionIdentifier Id="GR2002">
                <ElectionName>Gemeenteraad Nuth</ElectionName>
                <ElectionCategory>GR</ElectionCategory>
                <kr:ElectionDomain>Nuth</kr:ElectionDomain>
                <kr:ElectionDate>2002-03-06</kr:ElectionDate>
            </ElectionIdentifier>
            <Contests>
                <Contest>
                    <ContestIdentifier Id="geen">
                        <ContestName>Gemeente Nuth</ContestName>
                    </ContestIdentifier>
                    <TotalVotes>
                        <Selection>
                            <AffiliationIdentifier Id="1">
                                <RegisteredName>Lijst Lenoir</RegisteredName>
                            </AffiliationIdentifier>
                            <ValidVotes>1748</ValidVotes>
                        </Selection>
                        <Selection>
                            <Candidate>
                                <CandidateIdentifier Id="1"/>
                            </Candidate>
                            <ValidVotes>824</ValidVotes>
                        </Selection>
                        <Selection>
                            <Candidate>
                                <CandidateIdentifier Id="2"/>
                            </Candidate>
                            <ValidVotes>346</ValidVotes>
                        </Selection>
                        <Selection>
                            <Candidate>
                                <CandidateIdentifier Id="3"/>
                            </Candidate>
                            <ValidVotes>345</ValidVotes>
                        </Selection>
                        <Selection>
                            <Candidate>
                                <CandidateIdentifier Id="4"/>
                            </Candidate>
                            <ValidVotes>233</ValidVotes>
                        </Selection>
                        <Selection>
                            <AffiliationIdentifier Id="2">
                                <RegisteredName>Christen Democratisch App√®l (CDA)</RegisteredName>
                            </AffiliationIdentifier>
                            <ValidVotes>2895</ValidVotes>
                        </Selection>
                        <Selection>
                            <Candidate>
                                <CandidateIdentifier Id="1"/>
                            </Candidate>
                            <ValidVotes>994</ValidVotes>
                        </Selection>
                        <Selection>
                            <Candidate>
                                <CandidateIdentifier Id="2"/>
                            </Candidate>
                            <ValidVotes>303</ValidVotes>
                        </Selection>
                        <Selection>
                            <Candidate>
                                <CandidateIdentifier Id="3"/>
                            </Candidate>
                            <ValidVotes>253</ValidVotes>
                        </Selection>
                        <Selection>
                            <Candidate>
                                <CandidateIdentifier Id="4"/>
                            </Candidate>
                            <ValidVotes>235</ValidVotes>
                        </Selection>
                        <Selection>
                            <Candidate>
                                <CandidateIdentifier Id="5"/>
                            </Candidate>
                            <ValidVotes>577</ValidVotes>
                        </Selection>
                        <Selection>
                            <Candidate>
                                <CandidateIdentifier Id="16"/>
                            </Candidate>
                            <ValidVotes>533</ValidVotes>
                        </Selection>
                        <Selection>
                            <AffiliationIdentifier Id="3">
                                <RegisteredName>Partij van de Arbeid (P.v.d.A.)</RegisteredName>
                            </AffiliationIdentifier>
                            <ValidVotes>523</ValidVotes>
                        </Selection>
                        <Selection>
                            <Candidate>
                                <CandidateIdentifier Id="1"/>
                            </Candidate>
                            <ValidVotes>332</ValidVotes>
                        </Selection>
                        <Selection>
                            <Candidate>
                                <CandidateIdentifier Id="2"/>
                            </Candidate>
                            <ValidVotes>191</ValidVotes>
                        </Selection>
                        <Selection>
                            <AffiliationIdentifier Id="4">
                                <RegisteredName>VVD</RegisteredName>
                            </AffiliationIdentifier>
                            <ValidVotes>508</ValidVotes>
                        </Selection>
                        <Selection>
                            <Candidate>
                                <CandidateIdentifier Id="1"/>
                            </Candidate>
                            <ValidVotes>389</ValidVotes>
                        </Selection>
                        <Selection>
                            <Candidate>
                                <CandidateIdentifier Id="2"/>
                            </Candidate>
                            <ValidVotes>119</ValidVotes>
                        </Selection>
                        <Selection>
                            <AffiliationIdentifier Id="5">
                                <RegisteredName>Groot-Nuth</RegisteredName>
                            </AffiliationIdentifier>
                            <ValidVotes>293</ValidVotes>
                        </Selection>
                        <Selection>
                            <Candidate>
                                <CandidateIdentifier Id="1"/>
                            </Candidate>
                            <ValidVotes>293</ValidVotes>
                        </Selection>
                        <Selection>
                            <AffiliationIdentifier Id="6">
                                <RegisteredName>Politieke Partij &quot;LEEFBAAR NUTH&quot;</RegisteredName>
                            </AffiliationIdentifier>
                            <ValidVotes>269</ValidVotes>
                        </Selection>
                        <Selection>
                            <Candidate>
                                <CandidateIdentifier Id="1"/>
                            </Candidate>
                            <ValidVotes>269</ValidVotes>
                        </Selection>
                        <Selection>
                            <AffiliationIdentifier Id="7">
                                <RegisteredName>GROENLINKS</RegisteredName>
                            </AffiliationIdentifier>
                            <ValidVotes>231</ValidVotes>
                        </Selection>
                        <Selection>
                            <Candidate>
                                <CandidateIdentifier Id="1"/>
                            </Candidate>
                            <ValidVotes>231</ValidVotes>
                        </Selection>
                        <Cast>13011</Cast>
                        <TotalCounted>6480</TotalCounted>
                        <RejectedVotes ReasonCode="blanco">0</RejectedVotes>
                        <RejectedVotes ReasonCode="ongeldig">13</RejectedVotes>
                    </TotalVotes>
                    <ReportingUnitVotes>
                        <ReportingUnitIdentifier Id="0951::SB1">Stembureau 1 Trefcentrum Nuth</ReportingUnitIdentifier>
                        <Selection>
                            <AffiliationIdentifier Id="1">
                                <RegisteredName>Lijst Lenoir</RegisteredName>
                            </AffiliationIdentifier>
                            <ValidVotes>173</ValidVotes>
                        </Selection>
                        <Selection>
                            <Candidate>
                                <CandidateIdentifier Id="1"/>
                            </Candidate>
                            <ValidVotes>82</ValidVotes>
                        </Selection>
                        <Selection>
                            <Candidate>
                                <CandidateIdentifier Id="2"/>